{
  "is_hand": true,
  "hand_shape": "water",
  "heart_line": { "length": "long", "depth": "deep", "curvature": "gently_curved", "ending": "between_index_middle", "breaks": "none", "islands": "none", "chains": "none", "confidence": "high" },
  "head_line": { "length": "medium", "depth": "moderate", "curvature": "gently_curved", "ending": "other", "breaks": "none", "islands": "present", "chains": "none", "confidence": "medium" },
  "life_line": { "length": "long", "depth": "moderate", "curvature": "strongly_curved", "ending": "other", "breaks": "none", "islands": "none", "chains": "none", "confidence": "high" },
  "fate_line": { "present": "clear", "origin": "wrist", "confidence": "medium" },
  "mounts": [ { "name": "venus", "prominence": "prominent" }, { "name": "jupiter", "prominence": "moderate" } ],
  "notable_markings": [ { "type": "star", "location": "on the mount of apollo" } ],
  "line_geometry": {
    "heart_line": [[180, 360], [420, 320], [640, 330], [820, 360]],
    "head_line": [[190, 470], [430, 480], [690, 500]],
    "life_line": [[250, 380], [240, 560], [300, 760], [380, 880]],
    "fate_line": [[500, 880], [510, 600], [520, 360]]
  },
  "exposure_quality": "good",
  "overall_confidence": "high"
}
